{
  "attestations": {
    "approval_reference": "SYNTHETIC-FIXTURE-NO-EXTERNAL-DATA",
    "approved_for_replay": true,
    "attested_at": "2026-08-14T00:00:00+00:00",
    "attested_by": "phase2-fixture-generator",
    "deidentification_method": "synthetic-by-construction",
    "deidentified": true,
    "direct_identifiers_present": false
  },
  "created_at": "2026-08-14T00:00:00+00:00",
  "data_origin": "SYNTHETIC_FIXTURE",
  "dataset_id": "adf-phase2-starter-synthetic",
  "files": [
    {
      "adapter": "canonical_jsonl_v0.2",
      "path": "cases.jsonl",
      "record_count": 3,
      "role": "cases",
      "sha256": "2224e8fdebeec512880f89b43889195bdefa66389eee7ca70ac4370f1000d3d5"
    },
    {
      "adapter": "canonical_jsonl_v0.2",
      "path": "adjudications.jsonl",
      "record_count": 3,
      "role": "adjudications",
      "sha256": "9fbfba2f1e7f39aa26817f5956cc065434114d4cfe478e16dd478e5ae774a079"
    }
  ],
  "historical_case_count": 0,
  "intended_mode": "HISTORICAL_REPLAY",
  "schema_version": "0.2.0"
}